{
  "$schema": "https://json-schema.org/draft/2020-12/schema",
  "title": "Scrapling Benchmark Suite",
  "type": "object",
  "additionalProperties": false,
  "required": ["name", "version", "workloads"],
  "properties": {
    "name": {"type": "string"},
    "version": {"type": "integer"},
    "workloads": {
      "type": "array",
      "minItems": 1,
      "items": {
        "type": "object",
        "additionalProperties": false,
        "required": ["id", "weight"],
        "properties": {
          "id": {"type": "string"},
          "weight": {"type": "number", "minimum": 0},
          "required": {"type": "boolean"}
        }
      }
    },
    "defaults": {"type": "object"}
  }
}
