{
  "name": "browser_holdout",
  "version": 1,
  "workloads": [
    {
      "id": "holdout_browser_dynamic_extract",
      "weight": 0.55,
      "required": true
    },
    {
      "id": "holdout_browser_session_extract",
      "weight": 0.45,
      "required": true
    }
  ],
  "defaults": {
    "repetitions": 1,
    "warmups": 0,
    "timeout_ms": 30000
  }
}
