{
  "name": "holdout",
  "version": 1,
  "workloads": [
    {
      "id": "holdout_static_extract",
      "weight": 0.4,
      "required": true
    },
    {
      "id": "holdout_large_dom_extract",
      "weight": 0.35,
      "required": true
    },
    {
      "id": "holdout_text_similarity",
      "weight": 0.25,
      "required": true
    }
  ],
  "defaults": {
    "repetitions": 3,
    "warmups": 1,
    "timeout_ms": 30000
  }
}
